{
  "schema_version": 1,
  "id": "YB-1139",
  "revision": 2,
  "pack_id": "venus-cards-core",
  "mode": "yes_but",
  "status": "draft",
  "category": "humor",
  "interaction": "pair_private",
  "participants_required": 2,
  "meeting_contexts": [
    "online"
  ],
  "relationship_scope": "friend_or_more",
  "min_comfort": 1,
  "min_progression_stage": 3,
  "consent": "bilateral",
  "requires_physical_contact": false,
  "requires_going_away": false,
  "required_capabilities": [
    "private_text_chat"
  ],
  "safety_tags": [
    "private",
    "personal"
  ],
  "expected_duration_seconds": 60,
  "text": {
    "ru": {
      "proposal": "{P1}, предложи игроку {P2} добавить в личном чате по одному пункту в шуточное резюме уставшего шрифта, не называя реальных людей.",
      "responder": "{P2} может согласиться, предложить условие или отказаться без объяснений. Новое условие требует свободного согласия {P1}; начать можно только после явного подтверждения обоих. Каждый может передумать."
    },
    "en": {
      "proposal": "{P1}, invite {P2} to add one item each in private chat to a tired typeface's humorous CV without naming real people.",
      "responder": "{P2} may agree, suggest a condition, or decline without a reason. A new condition requires a free choice by {P1}; start only after both explicitly confirm. Either person may change their mind."
    },
    "tr": {
      "proposal": "{P1}, {P2} adlı oyuncuya özel sohbette gerçek insan adı vermeden yorgun yazı tipinin şakacı özgeçmişine birer madde eklemeyi öner.",
      "responder": "{P2} kabul edebilir, bir koşul önerebilir veya gerekçe göstermeden reddedebilir. Yeni koşulu {P1} özgürce değerlendirmelidir; ancak ikiniz de açıkça onayladıktan sonra başlayın. Her biriniz vazgeçebilirsiniz."
    }
  },
  "authoring": {
    "origin": "agent",
    "batch_id": "P04-PRIVATE-ONLINE-001-YB",
    "created_at": "2026-10-19T00:56:35Z",
    "reviewed_by": null,
    "reviewed_at": null,
    "rights_status": "needs_review",
    "policy_revision": "RE-1",
    "instruction_revision": 1,
    "source_notes": "R2 agent-authored processing of the user-supplied full 450-card HOLD review dated 2026-10-19. Stable ID and original r1 preserved in the disposition ledger. No external card collection used. Corrections, replacements and RU/EN/TR localizations remain draft; editorial, safety, rights, similarity, diversity and language verification of changed hashes is pending. This record is not an approval."
  }
}
