{
  "schema_version": 1,
  "id": "Q-1183",
  "revision": 1,
  "pack_id": "venus-cards-core",
  "mode": "questions",
  "status": "draft",
  "category": "boundaries",
  "interaction": "group",
  "participants_required": 0,
  "meeting_contexts": [
    "online",
    "in_person"
  ],
  "relationship_scope": "none",
  "min_comfort": 0,
  "min_progression_stage": 1,
  "consent": "individual",
  "requires_physical_contact": false,
  "requires_going_away": false,
  "required_capabilities": [],
  "safety_tags": [
    "neutral"
  ],
  "expected_duration_seconds": 60,
  "text": {
    "ru": {
      "question": "Что сказочному дракону труднее признать: что пора вздремнуть или что он устал летать? Отвечать можно только о драконе."
    },
    "en": {
      "question": "What might a fairy-tale dragon find harder to admit: needing a nap or being tired of flying? You can answer only about the dragon."
    },
    "tr": {
      "question": "Bir masal ejderhası için hangisini kabul etmek daha zor olurdu: biraz uykuya ihtiyacı olduğunu mu, uçmaktan yorulduğunu mu? Yalnızca ejderha hakkında yanıt verebilirsin."
    }
  },
  "authoring": {
    "origin": "agent",
    "batch_id": "P05-EXP470-Q-01",
    "created_at": "2026-10-19T21:12:34Z",
    "reviewed_by": null,
    "reviewed_at": null,
    "rights_status": "needs_review",
    "policy_revision": "RE-1",
    "instruction_revision": 1,
    "source_notes": "New agent draft for the standalone470 capacity expansion. Idea: Safe fictional personal-limit recognition; no real experience requested. Exact IDs reserved by the existing authoring CLI in a versioned copy. Human editorial, originality, safety and qualified RU/EN/TR review NOT performed. Not approved or activated."
  }
}
