{
  "schema_version": 1,
  "id": "YB-1119",
  "revision": 2,
  "pack_id": "venus-cards-core",
  "mode": "yes_but",
  "status": "draft",
  "category": "friendship",
  "interaction": "pair_private",
  "participants_required": 2,
  "meeting_contexts": [
    "in_person"
  ],
  "relationship_scope": "friend_or_more",
  "min_comfort": 1,
  "min_progression_stage": 3,
  "consent": "bilateral",
  "requires_physical_contact": false,
  "requires_going_away": false,
  "required_capabilities": [],
  "safety_tags": [
    "private",
    "personal"
  ],
  "expected_duration_seconds": 60,
  "text": {
    "ru": {
      "proposal": "{P1}, предложи игроку {P2} в вашем личном разговоре только между вами вместе подобрать благодарность за интересный вопрос так, чтобы она не звучала оценкой человека.",
      "responder": "{P2} может согласиться, предложить условие или отказаться без объяснений. Новое условие требует свободного согласия {P1}; начать можно только после явного подтверждения обоих. Каждый может передумать."
    },
    "en": {
      "proposal": "{P1}, invite {P2} in your private conversation between yourselves to choose a thank-you for an interesting question that does not judge the person together.",
      "responder": "{P2} may agree, suggest a condition, or decline without a reason. A new condition requires a free choice by {P1}; start only after both explicitly confirm. Either person may change their mind."
    },
    "tr": {
      "proposal": "{P1}, {P2} adlı oyuncuya yalnızca ikinizin özel konuşmasında kişiyi değerlendirme gibi duyulmayan ilginç soru teşekkürünü birlikte seçmeyi öner.",
      "responder": "{P2} kabul edebilir, bir koşul önerebilir veya gerekçe göstermeden reddedebilir. Yeni koşulu {P1} özgürce değerlendirmelidir; ancak ikiniz de açıkça onayladıktan sonra başlayın. Her biriniz vazgeçebilirsiniz."
    }
  },
  "authoring": {
    "origin": "agent",
    "batch_id": "P04-PRIVATE-IP-001-YB",
    "created_at": "2026-10-19T00:53:14Z",
    "reviewed_by": null,
    "reviewed_at": null,
    "rights_status": "needs_review",
    "policy_revision": "RE-1",
    "instruction_revision": 1,
    "source_notes": "R2 agent-authored processing of the user-supplied full 450-card HOLD review dated 2026-10-19. Stable ID and original r1 preserved in the disposition ledger. No external card collection used. Corrections, replacements and RU/EN/TR localizations remain draft; editorial, safety, rights, similarity, diversity and language verification of changed hashes is pending. This record is not an approval."
  }
}
