{
  "schema_version": 1,
  "id": "TD-1012",
  "revision": 1,
  "pack_id": "venus-cards-core",
  "mode": "truth_or_dare",
  "status": "draft",
  "category": "humor",
  "interaction": "solo",
  "participants_required": 1,
  "meeting_contexts": [
    "online",
    "in_person"
  ],
  "relationship_scope": "none",
  "min_comfort": 0,
  "min_progression_stage": 1,
  "consent": "individual",
  "requires_physical_contact": false,
  "requires_going_away": false,
  "required_capabilities": [],
  "safety_tags": [
    "neutral"
  ],
  "expected_duration_seconds": 60,
  "text": {
    "ru": {
      "truth": "{P1}, какое дело поручили бы детективу, который ищет только потерянные запятые?",
      "dare": "{P1}, придумай первую строчку истории о детективе потерянных запятых."
    },
    "en": {
      "truth": "{P1}, which case would a detective who finds only lost commas investigate?",
      "dare": "{P1}, invent the opening line of a story about a detective of lost commas."
    },
    "tr": {
      "truth": "{P1}, yalnızca kayıp virgülleri arayan dedektife hangi dava verilir?",
      "dare": "{P1}, kayıp virgüllerin dedektifi hakkında bir hikâyenin ilk cümlesini bul."
    }
  },
  "authoring": {
    "origin": "agent",
    "batch_id": "P04-NEUTRAL-001-TD",
    "created_at": "2026-10-19T00:23:00Z",
    "reviewed_by": null,
    "reviewed_at": null,
    "rights_status": "needs_review",
    "policy_revision": "RE-1",
    "instruction_revision": 1,
    "source_notes": "New agent brainstorm for a bounded neutral pilot batch. No external card collection used. Human originality, rights, safety and RU/EN/TR review NOT performed. Not a release catalogue."
  }
}
