{
  "schema_version": 1,
  "id": "Q-1071",
  "revision": 2,
  "pack_id": "venus-cards-core",
  "mode": "questions",
  "status": "draft",
  "category": "friendship",
  "interaction": "group",
  "participants_required": 0,
  "meeting_contexts": [
    "online",
    "in_person"
  ],
  "relationship_scope": "none",
  "min_comfort": 0,
  "min_progression_stage": 1,
  "consent": "individual",
  "requires_physical_contact": false,
  "requires_going_away": false,
  "required_capabilities": [],
  "safety_tags": [
    "neutral"
  ],
  "expected_duration_seconds": 60,
  "text": {
    "ru": {
      "question": "В компании сказочных путешественников ты выбираешь маршрут или музыку в дорогу? Почему?"
    },
    "en": {
      "question": "Among fairy-tale travellers, would you choose the route or the travel music? Why?"
    },
    "tr": {
      "question": "Masal yolcuları arasında rotayı mı yol müziğini mi seçmek isterdin? Neden?"
    }
  },
  "authoring": {
    "origin": "agent",
    "batch_id": "P04-NEUTRAL-004-Q",
    "created_at": "2026-10-19T00:36:50Z",
    "reviewed_by": null,
    "reviewed_at": null,
    "rights_status": "needs_review",
    "policy_revision": "RE-1",
    "instruction_revision": 1,
    "source_notes": "R2 agent-authored processing of the user-supplied full 450-card HOLD review dated 2026-10-19. Stable ID and original r1 preserved in the disposition ledger. No external card collection used. Corrections, replacements and RU/EN/TR localizations remain draft; editorial, safety, rights, similarity, diversity and language verification of changed hashes is pending. This record is not an approval."
  }
}
