{
  "schema_version": 1,
  "id": "TD-1154",
  "revision": 2,
  "pack_id": "venus-cards-core",
  "mode": "truth_or_dare",
  "status": "draft",
  "category": "boundaries",
  "interaction": "solo",
  "participants_required": 1,
  "meeting_contexts": [
    "online",
    "in_person"
  ],
  "relationship_scope": "none",
  "min_comfort": 0,
  "min_progression_stage": 1,
  "consent": "individual",
  "requires_physical_contact": false,
  "requires_going_away": false,
  "required_capabilities": [],
  "safety_tags": [
    "neutral"
  ],
  "expected_duration_seconds": 60,
  "text": {
    "ru": {
      "truth": "{P1}, в комнате сказочных лета и зимы тебе удобнее иметь свой угол или каждый раз договариваться об общем месте?",
      "dare": "{P1}, опиши, как сказочные лето и зима предлагают изменить размер своих уголков так, чтобы любой мог отказаться. Место не меняют без согласия обоих."
    },
    "en": {
      "truth": "{P1}, in a room shared by fairy-tale summer and winter, would you prefer your own corner or agreeing on a shared space each time?",
      "dare": "{P1}, describe how fairy-tale summer and winter propose resizing their corners so either can decline. The space changes only when both agree."
    },
    "tr": {
      "truth": "{P1}, masaldaki yaz ile kışın odasında kendi köşen olması mı, ortak yer için her seferinde anlaşmak mı sana daha uygun?",
      "dare": "{P1}, masaldaki yaz ile kışın köşelerinin boyutunu değiştirirken ikisinin de reddedebileceği bir öneriyi anlat. Yer ancak ikisi de kabul ederse değişir."
    }
  },
  "authoring": {
    "origin": "agent",
    "batch_id": "P04-R2-FULL-PUBLIC-TD",
    "created_at": "2026-10-19T12:52:44Z",
    "reviewed_by": null,
    "reviewed_at": null,
    "rights_status": "needs_review",
    "policy_revision": "RE-1",
    "instruction_revision": 3,
    "source_notes": "Root-authored correction of owner review470r2 (2026-10-20), actions139. Stable ID; exact previous bytes in p04-r3/revision-history and hash-bound disposition. Original scenes and RU/EN/TR edits; no external card collection. Remains draft pending independent correction review and human editorial, language, rights and safety acceptance. Not activated."
  }
}
