{
  "schema_version": 1,
  "id": "TD-0002",
  "revision": 1,
  "pack_id": "venus-cards-core",
  "mode": "truth_or_dare",
  "status": "draft",
  "category": "memory",
  "interaction": "solo",
  "participants_required": 1,
  "meeting_contexts": [
    "online",
    "in_person"
  ],
  "relationship_scope": "none",
  "min_comfort": 1,
  "min_progression_stage": 2,
  "consent": "individual",
  "requires_physical_contact": false,
  "requires_going_away": false,
  "required_capabilities": [],
  "safety_tags": [
    "personal",
    "music"
  ],
  "expected_duration_seconds": 60,
  "text": {
    "ru": {
      "truth": "{P1}, какую песню ты слушал чаще всего прошлой осенью?",
      "dare": "{P1}, напой несколько нот мелодии, которая тебя успокаивает."
    },
    "en": {
      "truth": "{P1}, which song did you listen to most last autumn?",
      "dare": "{P1}, hum a few notes of a melody that calms you."
    },
    "tr": {
      "truth": "{P1}, Geçen sonbaharda en çok hangi şarkıyı dinledin?",
      "dare": "{P1}, Seni sakinleştiren bir melodinin birkaç notasını mırıldan."
    }
  },
  "authoring": {
    "origin": "example",
    "batch_id": "SAMPLE-20261018",
    "created_at": "2026-10-18T00:00:00Z",
    "reviewed_by": null,
    "reviewed_at": null,
    "rights_status": "needs_review",
    "policy_revision": "RE-1",
    "instruction_revision": 1,
    "source_notes": "Illustrative concept-only sample; not reviewed for production."
  }
}
