{
  "schema_version": 1,
  "id": "TD-1156",
  "revision": 2,
  "pack_id": "venus-cards-core",
  "mode": "truth_or_dare",
  "status": "draft",
  "category": "boundaries",
  "interaction": "pair_private",
  "participants_required": 2,
  "meeting_contexts": [
    "in_person"
  ],
  "relationship_scope": "friend_or_more",
  "min_comfort": 1,
  "min_progression_stage": 3,
  "consent": "bilateral",
  "requires_physical_contact": false,
  "requires_going_away": false,
  "required_capabilities": [
    "private_text_chat"
  ],
  "safety_tags": [
    "private",
    "personal"
  ],
  "expected_duration_seconds": 60,
  "text": {
    "ru": {
      "truth": "{P1} и {P2}, если оба хотите, только в личном чате: Тебе приятнее хранить маленький сувенир без истории или рассказывать, почему он дорог?",
      "dare": "{P1} и {P2}, если оба хотите, в личном чате придумайте сувениру музейную подпись и совсем вымышленную личную подпись. Создавать общий секрет не нужно; любую часть можно пропустить."
    },
    "en": {
      "truth": "{P1} and {P2}, if you both wish, only in private chat: Would you rather keep a little souvenir unexplained or tell why it matters?",
      "dare": "{P1} and {P2}, if you both wish, invent a museum label and a wholly fictional personal label for a souvenir in private chat. No shared secret is needed; you may skip either part."
    },
    "tr": {
      "truth": "{P1} ve {P2}, ikiniz de isterseniz, yalnızca özel sohbette: Küçük hatırayı açıklamadan saklamak mı, değerini anlatmak mı daha hoş?",
      "dare": "{P1} ve {P2}, ikiniz de isterseniz özel sohbette bir hatıraya müze etiketi ve tamamen hayali bir kişisel etiket bulun. Ortak sır gerekmiyor; istediğiniz kısmı geçebilirsiniz."
    }
  },
  "authoring": {
    "origin": "agent",
    "batch_id": "P04-R2-FULL-IP-TD",
    "created_at": "2026-10-19T12:52:44Z",
    "reviewed_by": null,
    "reviewed_at": null,
    "rights_status": "needs_review",
    "policy_revision": "RE-1",
    "instruction_revision": 3,
    "source_notes": "Root-authored correction of owner review470r2 (2026-10-20), actions139. Stable ID; exact previous bytes in p04-r3/revision-history and hash-bound disposition. Original scenes and RU/EN/TR edits; no external card collection. Remains draft pending independent correction review and human editorial, language, rights and safety acceptance. Not activated."
  }
}
