{
  "schema_version": 1,
  "id": "TD-1160",
  "revision": 3,
  "pack_id": "venus-cards-core",
  "mode": "truth_or_dare",
  "status": "draft",
  "category": "boundaries",
  "interaction": "pair_private",
  "participants_required": 2,
  "meeting_contexts": [
    "online",
    "in_person"
  ],
  "relationship_scope": "friend_or_more",
  "min_comfort": 1,
  "min_progression_stage": 3,
  "consent": "bilateral",
  "requires_physical_contact": false,
  "requires_going_away": false,
  "required_capabilities": [
    "private_text_chat"
  ],
  "safety_tags": [
    "private",
    "personal"
  ],
  "expected_duration_seconds": 60,
  "text": {
    "ru": {
      "truth": "{P1} и {P2}, если оба хотите, в личном чате каждый ответьте: любимый кусочек вымышленного торта вы бы оставили напоследок или начали с него?",
      "dare": "{P1} и {P2}, если оба хотите, в личном чате каждый выберите собственный порядок трёх слоёв торта из настроений. Опишите один слой; есть ничего не нужно."
    },
    "en": {
      "truth": "{P1} and {P2}, if you both wish, each answer in private chat: would you save your favourite part of an imaginary cake until last or start with it?",
      "dare": "{P1} and {P2}, if you both wish, each choose your own order for three mood-flavoured cake layers in private chat. Describe one layer; no eating is needed."
    },
    "tr": {
      "truth": "{P1} ve {P2}, ikiniz de isterseniz özel sohbette her biriniz yanıtlayın: hayali pastanın en sevdiğiniz kısmını sona mı bırakır, önce mi tadardınız?",
      "dare": "{P1} ve {P2}, ikiniz de isterseniz özel sohbette her biriniz üç ruh hali katmanını kendi sıranıza dizin. Bir katmanı anlatın; bir şey yemeniz gerekmiyor."
    }
  },
  "authoring": {
    "origin": "agent",
    "batch_id": "P04-R2-FULL-IP-TD",
    "created_at": "2026-10-19T12:52:44Z",
    "reviewed_by": null,
    "reviewed_at": null,
    "rights_status": "needs_review",
    "policy_revision": "RE-1",
    "instruction_revision": 3,
    "source_notes": "Root-authored correction of owner review470r2 (2026-10-20), actions139. Stable ID; exact previous bytes in p04-r3/revision-history and hash-bound disposition. Original scenes and RU/EN/TR edits; no external card collection. Remains draft pending independent correction review and human editorial, language, rights and safety acceptance. Not activated."
  }
}
