{
  "schema_version": 1,
  "id": "YB-1122",
  "revision": 1,
  "pack_id": "venus-cards-core",
  "mode": "yes_but",
  "status": "draft",
  "category": "boundaries",
  "interaction": "pair_private",
  "participants_required": 2,
  "meeting_contexts": [
    "in_person"
  ],
  "relationship_scope": "friend_or_more",
  "min_comfort": 1,
  "min_progression_stage": 3,
  "consent": "bilateral",
  "requires_physical_contact": false,
  "requires_going_away": false,
  "required_capabilities": [],
  "safety_tags": [
    "private",
    "personal"
  ],
  "expected_duration_seconds": 60,
  "text": {
    "ru": {
      "proposal": "{P1}, предложи игроку {P2} в вашем личном разговоре только между вами придумать удобный обоим способ обозначить, что вопрос сейчас можно просто пропустить; проверять его на практике необязательно.",
      "responder": "Игрок {P2} может согласиться, предложить своё условие или отказаться без объяснений."
    },
    "en": {
      "proposal": "{P1}, invite {P2} in your private conversation between yourselves to invent a way both like to say a question can simply be skipped now; no practical test is needed.",
      "responder": "{P2} may agree, set their own condition, or decline without giving a reason."
    },
    "tr": {
      "proposal": "{P1}, {P2} adlı oyuncuya yalnızca ikinizin özel konuşmasında şu an sorunun geçilebileceğini söylemek için ikinize uygun yolu bulmayı öner. Uygulamada denemek gerekmez.",
      "responder": "{P2} kabul edebilir, kendi koşulunu belirtebilir veya açıklama yapmadan reddedebilir."
    }
  },
  "authoring": {
    "origin": "agent",
    "batch_id": "P04-PRIVATE-IP-002-YB",
    "created_at": "2026-10-19T00:53:14Z",
    "reviewed_by": null,
    "reviewed_at": null,
    "rights_status": "needs_review",
    "policy_revision": "RE-1",
    "instruction_revision": 1,
    "source_notes": "Agent-authored in-person private-pair draft concepts and RU/EN/TR draft localizations. Assumes an already available mutually chosen private moment; does not instruct leaving, isolation, contact or disclosure. No external card collection used. Human originality, rights, safety, cultural suitability, similarity, diversity and tri-locale review NOT performed; not approved or publishable."
  }
}
