{
  "schema_version": 1,
  "id": "YB-1136",
  "revision": 1,
  "pack_id": "venus-cards-core",
  "mode": "yes_but",
  "status": "draft",
  "category": "humor",
  "interaction": "pair_private",
  "participants_required": 2,
  "meeting_contexts": [
    "online"
  ],
  "relationship_scope": "friend_or_more",
  "min_comfort": 1,
  "min_progression_stage": 3,
  "consent": "bilateral",
  "requires_physical_contact": false,
  "requires_going_away": false,
  "required_capabilities": [
    "private_text_chat"
  ],
  "safety_tags": [
    "private",
    "personal"
  ],
  "expected_duration_seconds": 60,
  "text": {
    "ru": {
      "proposal": "{P1}, предложи игроку {P2} написать в личном чате диалог из двух строк между слишком длинным словом и тесной строчкой, без шуток о людях.",
      "responder": "Игрок {P2} может согласиться, предложить своё условие или отказаться без объяснений."
    },
    "en": {
      "proposal": "{P1}, invite {P2} to write a two-line private-chat dialogue between an overly long word and a cramped line without jokes about people.",
      "responder": "{P2} may agree, set their own condition, or decline without giving a reason."
    },
    "tr": {
      "proposal": "{P1}, {P2} adlı oyuncuya özel sohbette insanlarla şakalaşmadan aşırı uzun sözcükle dar satırın iki satırlık diyaloğunu yazmayı öner.",
      "responder": "{P2} kabul edebilir, kendi koşulunu belirtebilir veya açıklama yapmadan reddedebilir."
    }
  },
  "authoring": {
    "origin": "agent",
    "batch_id": "P04-PRIVATE-ONLINE-001-YB",
    "created_at": "2026-10-19T00:56:35Z",
    "reviewed_by": null,
    "reviewed_at": null,
    "rights_status": "needs_review",
    "policy_revision": "RE-1",
    "instruction_revision": 1,
    "source_notes": "Agent-authored online private-text-chat draft concepts and RU/EN/TR draft localizations; limited to mutually chosen text exchange between the pair, without attachments, recording, screenshots, proof, contact, going away or disclosure of private data. Requires private_text_chat capability. No external card collection used. Human originality, rights, safety, cultural suitability, similarity, diversity and tri-locale review NOT performed; not approved or publishable."
  }
}
