{
  "schema_version": 1,
  "id": "Q-1137",
  "revision": 2,
  "pack_id": "venus-cards-core",
  "mode": "questions",
  "status": "draft",
  "category": "humor",
  "interaction": "pair_private",
  "participants_required": 2,
  "meeting_contexts": [
    "online",
    "in_person"
  ],
  "relationship_scope": "friend_or_more",
  "min_comfort": 1,
  "min_progression_stage": 3,
  "consent": "bilateral",
  "requires_physical_contact": false,
  "requires_going_away": false,
  "required_capabilities": [
    "private_text_chat"
  ],
  "safety_tags": [
    "private",
    "personal"
  ],
  "expected_duration_seconds": 60,
  "text": {
    "ru": {
      "question": "{P1} и {P2}, если оба хотите, ответьте друг другу только в личном чате: какой забавный, но добрый заголовок каждый предложил бы новости о слишком длинном пробеле?"
    },
    "en": {
      "question": "{P1} and {P2}, if you both wish, answer each other only in private chat: which funny but kind headline would each suggest about an overly long space?"
    },
    "tr": {
      "question": "{P1} ve {P2}, ikiniz de isterseniz yalnızca özel sohbette birbirinize yanıt yazın: aşırı uzun boşluk haberine her biriniz hangi komik ama iyi niyetli başlığı önerir?"
    }
  },
  "authoring": {
    "origin": "agent",
    "batch_id": "P04-PRIVATE-ONLINE-001-Q",
    "created_at": "2026-10-19T00:56:35Z",
    "reviewed_by": null,
    "reviewed_at": null,
    "rights_status": "needs_review",
    "policy_revision": "RE-1",
    "instruction_revision": 1,
    "source_notes": "Agent-authored online private-text-chat draft concepts and RU/EN/TR draft localizations; limited to mutually chosen text exchange between the pair, without attachments, recording, screenshots, proof, contact, going away or disclosure of private data. Requires private_text_chat capability. No external card collection used. Human originality, rights, safety, cultural suitability, similarity, diversity and tri-locale review NOT performed; not approved or publishable."
  }
}
