{
  "schema_version": 1,
  "id": "TD-1028",
  "revision": 3,
  "pack_id": "venus-cards-core",
  "mode": "truth_or_dare",
  "status": "draft",
  "category": "icebreaker",
  "interaction": "solo",
  "participants_required": 1,
  "meeting_contexts": [
    "online",
    "in_person"
  ],
  "relationship_scope": "none",
  "min_comfort": 0,
  "min_progression_stage": 1,
  "consent": "individual",
  "requires_physical_contact": false,
  "requires_going_away": false,
  "required_capabilities": [],
  "safety_tags": [
    "neutral"
  ],
  "expected_duration_seconds": 60,
  "text": {
    "ru": {
      "truth": "{P1}, какой камень тебе было бы любопытнее послушать: речную гальку, вулканический камень или свой вариант? Что ты надеешься услышать?",
      "dare": "{P1}, опиши речной камень с загадочной деталью: внутри него слышен воображаемый прибой."
    },
    "en": {
      "truth": "{P1}, which stone would you be more curious to listen to: a river pebble, a volcanic rock, or another kind? What would you hope to hear?",
      "dare": "{P1}, describe a river stone with a mystery: imaginary surf can be heard inside it."
    },
    "tr": {
      "truth": "{P1}, hangi taşı dinlemek daha çok ilgini çeker: nehir çakılı, volkanik taş ya da başka bir taş mı? Ne duymayı umardın?",
      "dare": "{P1}, içinden hayali dalga sesi gelen gizemli bir nehir taşını anlat."
    }
  },
  "authoring": {
    "origin": "agent",
    "batch_id": "P04-NEUTRAL-002-TD",
    "created_at": "2026-10-19T00:36:50Z",
    "reviewed_by": null,
    "reviewed_at": null,
    "rights_status": "needs_review",
    "policy_revision": "RE-1",
    "instruction_revision": 2,
    "source_notes": "Root-authored correction of owner review470r2 (2026-10-20), actions139. Stable ID; exact previous bytes in p04-r3/revision-history and hash-bound disposition. Original scenes and RU/EN/TR edits; no external card collection. Remains draft pending independent correction review and human editorial, language, rights and safety acceptance. Not activated."
  }
}
