{
  "schema_version": 1,
  "id": "TD-1028",
  "revision": 1,
  "pack_id": "venus-cards-core",
  "mode": "truth_or_dare",
  "status": "draft",
  "category": "icebreaker",
  "interaction": "solo",
  "participants_required": 1,
  "meeting_contexts": [
    "online",
    "in_person"
  ],
  "relationship_scope": "none",
  "min_comfort": 0,
  "min_progression_stage": 1,
  "consent": "individual",
  "requires_physical_contact": false,
  "requires_going_away": false,
  "required_capabilities": [],
  "safety_tags": [
    "neutral"
  ],
  "expected_duration_seconds": 60,
  "text": {
    "ru": {
      "truth": "{P1}, какой вопрос первым задал бы посетитель выставки камней?",
      "dare": "{P1}, составь двухстрочное описание гладкого речного камня."
    },
    "en": {
      "truth": "{P1}, what might a visitor first ask at a rock exhibition?",
      "dare": "{P1}, give a two-line description of a smooth river stone."
    },
    "tr": {
      "truth": "{P1}, taş sergisine gelen biri önce ne sorabilir?",
      "dare": "{P1}, pürüzsüz bir nehir taşını iki cümleyle anlat."
    }
  },
  "authoring": {
    "origin": "agent",
    "batch_id": "P04-NEUTRAL-002-TD",
    "created_at": "2026-10-19T00:36:50Z",
    "reviewed_by": null,
    "reviewed_at": null,
    "rights_status": "needs_review",
    "policy_revision": "RE-1",
    "instruction_revision": 1,
    "source_notes": "New agent-authored neutral draft concepts and RU/EN/TR draft localizations; no external card collection used. Human originality, rights, safety, cultural suitability, similarity, diversity and tri-locale review have NOT been performed. No approval or release readiness is asserted."
  }
}
