{
  "schema_version": 1,
  "id": "YB-1038",
  "revision": 3,
  "pack_id": "venus-cards-core",
  "mode": "yes_but",
  "status": "draft",
  "category": "music",
  "interaction": "pair_public",
  "participants_required": 2,
  "meeting_contexts": [
    "online",
    "in_person"
  ],
  "relationship_scope": "acquaintance",
  "min_comfort": 0,
  "min_progression_stage": 1,
  "consent": "bilateral",
  "requires_physical_contact": false,
  "requires_going_away": false,
  "required_capabilities": [],
  "safety_tags": [
    "neutral"
  ],
  "expected_duration_seconds": 60,
  "text": {
    "ru": {
      "proposal": "{P1}, предложи {P2}: придумать два разных появления сказочного кота: под мягкий звук и под резкий; исполнение не требуется.",
      "responder": "{P2} может согласиться, предложить условие или отказаться без объяснений. Новое условие требует свободного согласия {P1}; начать можно только после явного подтверждения обоих. Каждый может передумать."
    },
    "en": {
      "proposal": "{P1}, suggest to {P2}: imagine a fairy-tale cat arriving twice, once with a gentle sound and once with a sharp one; no performance is needed.",
      "responder": "{P2} may agree, suggest a condition, or decline without a reason. A new condition requires a free choice by {P1}; start only after both explicitly confirm. Either person may change their mind."
    },
    "tr": {
      "proposal": "{P1}, {P2} ile masal kedisinin yumuşak ve keskin sesle iki farklı gelişini hayal etmeyi öner. Ses çıkarmanız gerekmiyor.",
      "responder": "{P2} kabul edebilir, bir koşul önerebilir veya gerekçe göstermeden reddedebilir. Yeni koşulu {P1} özgürce değerlendirmelidir; ancak ikiniz de açıkça onayladıktan sonra başlayın. Her biriniz vazgeçebilirsiniz."
    }
  },
  "authoring": {
    "origin": "agent",
    "batch_id": "P04-NEUTRAL-002-YB",
    "created_at": "2026-10-19T00:36:50Z",
    "reviewed_by": null,
    "reviewed_at": null,
    "rights_status": "needs_review",
    "policy_revision": "RE-1",
    "instruction_revision": 2,
    "source_notes": "Full R2 draft follow-up after owner HOLD and independent content findings. Earlier R1 and frozen partial R2 remain unchanged. This revision repairs identified language/semantic overlap only; human editorial, safety, RU/EN/TR, originality/rights, similarity and diversity review of the changed bytes remains pending. Not approved or publishable."
  }
}
