{
  "schema_version": 1,
  "id": "Q-1034",
  "revision": 1,
  "pack_id": "venus-cards-core",
  "mode": "questions",
  "status": "draft",
  "category": "icebreaker",
  "interaction": "group",
  "participants_required": 0,
  "meeting_contexts": [
    "online",
    "in_person"
  ],
  "relationship_scope": "none",
  "min_comfort": 0,
  "min_progression_stage": 1,
  "consent": "individual",
  "requires_physical_contact": false,
  "requires_going_away": false,
  "required_capabilities": [],
  "safety_tags": [
    "neutral"
  ],
  "expected_duration_seconds": 60,
  "text": {
    "ru": {
      "question": "Какой раздел нужен путеводителю по обычной кухне?"
    },
    "en": {
      "question": "What section should a guide to an ordinary kitchen include?"
    },
    "tr": {
      "question": "Sıradan bir mutfağın rehberinde hangi bölüm bulunmalı?"
    }
  },
  "authoring": {
    "origin": "agent",
    "batch_id": "P04-NEUTRAL-002-Q",
    "created_at": "2026-10-19T00:36:50Z",
    "reviewed_by": null,
    "reviewed_at": null,
    "rights_status": "needs_review",
    "policy_revision": "RE-1",
    "instruction_revision": 1,
    "source_notes": "New agent-authored neutral draft concepts and RU/EN/TR draft localizations; no external card collection used. Human originality, rights, safety, cultural suitability, similarity, diversity and tri-locale review have NOT been performed. No approval or release readiness is asserted."
  }
}
