{
  "schema_version": 1,
  "id": "Q-1182",
  "revision": 2,
  "pack_id": "venus-cards-core",
  "mode": "questions",
  "status": "draft",
  "category": "boundaries",
  "interaction": "group",
  "participants_required": 0,
  "meeting_contexts": [
    "online",
    "in_person"
  ],
  "relationship_scope": "none",
  "min_comfort": 0,
  "min_progression_stage": 1,
  "consent": "individual",
  "requires_physical_contact": false,
  "requires_going_away": false,
  "required_capabilities": [],
  "safety_tags": [
    "neutral"
  ],
  "expected_duration_seconds": 60,
  "text": {
    "ru": {
      "question": "В сказке волшебник слышит мысли только вымышленных персонажей, которые разрешили ему их услышать. Мысли игроков ему недоступны. Какую часть дня он оставил бы полностью тихой?"
    },
    "en": {
      "question": "In a fairy tale, a wizard hears only fictional characters’ thoughts, with their permission. Players’ thoughts are out of reach. Which part of the day would the wizard leave completely quiet?"
    },
    "tr": {
      "question": "Bir masalda büyücü yalnızca izin veren hayali karakterlerin düşüncelerini duyabiliyor. Oyuncuların düşüncelerine erişemiyor. Günün hangi bölümünü tamamen sessiz bırakırdı?"
    }
  },
  "authoring": {
    "origin": "agent",
    "batch_id": "P05-EXP470-Q-01",
    "created_at": "2026-10-19T21:12:34Z",
    "reviewed_by": null,
    "reviewed_at": null,
    "rights_status": "needs_review",
    "policy_revision": "RE-1",
    "instruction_revision": 2,
    "source_notes": "Root-authored correction of owner review470r2 (2026-10-20), actions139. Stable ID; exact previous bytes in p04-r3/revision-history and hash-bound disposition. Original scenes and RU/EN/TR edits; no external card collection. Remains draft pending independent correction review and human editorial, language, rights and safety acceptance. Not activated."
  }
}
