{
  "schema_version": 1,
  "id": "Q-1154",
  "revision": 1,
  "pack_id": "venus-cards-core",
  "mode": "questions",
  "status": "draft",
  "category": "boundaries",
  "interaction": "group",
  "participants_required": 0,
  "meeting_contexts": [
    "online",
    "in_person"
  ],
  "relationship_scope": "none",
  "min_comfort": 0,
  "min_progression_stage": 1,
  "consent": "individual",
  "requires_physical_contact": false,
  "requires_going_away": false,
  "required_capabilities": [],
  "safety_tags": [
    "neutral"
  ],
  "expected_duration_seconds": 60,
  "text": {
    "ru": {
      "question": "В воображаемом отеле предлагают день без часов. Какой один ориентир времени всё же стоит оставить?"
    },
    "en": {
      "question": "An imaginary hotel offers a day without clocks. What single clue to the time would you keep?"
    },
    "tr": {
      "question": "Hayali bir otel saatsiz bir gün sunuyor. Zamanı anlamak için hangi tek ipucunu tutardınız?"
    }
  },
  "authoring": {
    "origin": "agent",
    "batch_id": "P04-R2-FULL-PUBLIC-Q",
    "created_at": "2026-10-19T12:52:44Z",
    "reviewed_by": null,
    "reviewed_at": null,
    "rights_status": "needs_review",
    "policy_revision": "RE-1",
    "instruction_revision": 2,
    "source_notes": "New agent-authored replacement for full R2 draft coverage after owner HOLD. Distinct newly reserved ID; removed rules/HOLD IDs stay inactive. No external card collection used. Personal preferences and imagined scenes are optional; no real identifying details or physical action required. Editorial, safety, RU/EN/TR, originality/rights, similarity and diversity review remain pending; not approved or publishable."
  }
}
